#id	value
sections-0/paragraphs-3/text	Восстановление водного пути Е40 предусматривает следующие мероприятия: на территории Польши должен быть построен искусственный канал длиной около 160 км; осуществлена модернизация и строительство гидротехнических сооружений в трех странах: на Висле, Днепре, Припяти и Днепро-Бугском канале (включая увеличение габаритов фарватера, строительство гидроузлов на реках, водохранилищ и т.д.). Морской институт (Польша) разработал технико-экономическое обоснование реализации такого проекта.
sections-0/paragraphs-25/text	Строительство водного пути E40 приведет к потере туристов, которые приезжают в Полесье главным образом, чтобы увидеть Припять — последнюю среднюю реку в Центральной Европе, которая сохранилась в мало изменённом виде. Таким образом значительное количество населения, ориентированного на получение доходов от предоставления услуг туристам и реализации своей продукции, потеряют работу и доходы.
sections-0/paragraphs-37/text	Учитывая вышесказанное, мы, общественные организации Беларуси, Украины и Польши намерены препятствовать созданию гидротехнических сооружений на реках Припять и Висла на всех этапах проекта, а в случае если такая инфраструктура будет создана — добиваться ее демонтажа.
title	Заявление организаций
sections-0/paragraphs-38/style	bold
sections-0/paragraphs-0/text	Общественные организации Беларуси, Украины и Польши обращают внимание на пагубные экологические последствия и повышенные инвестиционные риски проекта Е40 и призывают отказаться от его реализации, сосредоточившись на иных трансграничных проектах в сфере транспорта и логистики.
sections-0/paragraphs-4/text	Общественники и ученые Беларуси, Украины и Польши выступают против реализации такого проекта, так как существует прямая угроза утраты мест обитания и произрастания редких и находящихся под угрозой исчезновения видов, редких биотопов и природных ландшафтов, ухудшения гидрологического режима, снижения рыбных запасов и т.д.
sections-0/paragraphs-22/text	Водный путь Е40, в то же время является так называемым Центральным инвазионным коридором, по которому происходит инвазия понто-каспийских чужеродных гидробионтов в водные объекты Европы. Наиболее важным (и первым) звеном в этом коридоре является расположенный на территории Беларуси Днепро-Бугский канал, соединяющий бассейны Черного и Балтийского морей. Создание же (реконструкция) судоходных каналов и шлюзов для прохождения судов по белорусскому участку пути Е40 будет способствовать проникновению и дальнейшему распространению чужеродных понто-каспийских гидробионтов как на территорию Польши, так и других западноевропейских стран.
